id;description;disabled;model;productcode;productname;product_price;size;size_description;in_stock
1;card Licensed Cotton Ball;false;bypass Ameliorated;Brand;infomediaries Som Rustic Frozen Keyboard;44235;Optimized;microchip;66019
2;motivating Operations alarm;true;Credit Card Account paradigms;Louisiana;hack;1439;Wooden Ergonomic Steel Gloves;Developer Shoes Music;76336
3;online e-business;false;withdrawal Generic Frozen Tuna;Gorgeous Cotton Chair Personal Loan Account Borders;Norfolk Island Chilean Peso Unidades de fomento Checking Account;94389;Solutions COM;Data North Dakota;38816
4;deposit Station;true;Web revolutionize Branding;teal analyzing yellow;Books Generic;68300;Handcrafted Plastic Shirt quantifying;wireless;26069
5;Avon;true;extensible Accountability Handmade Cotton Bacon;intermediate Table quantify;Wyoming interface Cotton;25001;Louisiana JSON Texas;bandwidth;75087
6;compress Fantastic Global;true;navigating encoding;Fantastic Small Frozen Salad bypassing;time-frame Quality;95060;Missouri deposit;Gorgeous Money Market Account;55370
7;ivory Data neural;false;Optimization;Tasty Rubber Car mindshare EXE;bandwidth Liaison;68803;generating SDD bypassing;Algerian Dinar Fantastic Fresh Salad;70624
8;Sleek;false;Planner;PCI SAS;Interactions;98600;navigate repurpose;Buckinghamshire;37798
9;system Triple-buffered;false;supply-chains;Tools;Arizona hack;76719;quantifying;synthesize Idaho Markets;37487
10;asymmetric EXE;false;Assistant Industrial;Arizona success Sleek Frozen Chips;Gorgeous Rubber Chicken Associate Central African Republic;62939;Dalasi;Orchestrator Naira;38420
